{
  "contract_version": "1.0.0",
  "artifact_kind": "plan",
  "plan_id": "sha256:aaaaaaaaaaaaaaaaaaaaaaaaaaaaaaaaaaaaaaaaaaaaaaaaaaaaaaaaaaaaaaaa",
  "created_at": "2026-08-16T10:02:00Z",
  "inventory_digest": "sha256:bbbbbbbbbbbbbbbbbbbbbbbbbbbbbbbbbbbbbbbbbbbbbbbbbbbbbbbbbbbbbbbb",
  "desired_state_digest": "sha256:cccccccccccccccccccccccccccccccccccccccccccccccccccccccccccccccc",
  "status": "ready",
  "operations": {
    "sonarr-main:quality_profile:hd-balanced:cutoff": {
      "action": "update",
      "risk": "safe",
      "requires_human_approval": false,
      "change": {
        "before": "web-1080p",
        "after": "bluray-1080p"
      }
    }
  },
  "blocked_assumptions": []
}
